{
  "atlas_valid": true,
  "broken_links": [],
  "findings": [],
  "kind": "documentation-audit",
  "metadata_digest": "0000000000000000000000000000000000000000000000000000000000000000",
  "orphan_documents": [],
  "policy_digest": "1111111111111111111111111111111111111111111111111111111111111111",
  "schema_version": 1,
  "version": 1
}
